{
  "$schema": "https://schemas.macro-deck.app/macrodeck-certificate-v1.schema.json",
  "schemaVersion": 1,
  "subject": {
    "kind": "creator",
    "id": "392408488468283561",
    "name": "jhnnr desu"
  },
  "algorithm": "ed25519",
  "certificateId": "cert_c240981952797563babdcdc959e7f4fb",
  "publicKey": "89wNXdZjAx\u002BQNKoN9902riz05TNNCQ8LGMUIaKKt/PY=",
  "keyUsage": [
    "package"
  ],
  "notBefore": "2026-09-26T02:28:38.2541003+00:00",
  "notAfter": "2028-09-25T02:28:38.2541003+00:00",
  "issuedAt": "2026-09-26T02:28:38.2541003+00:00",
  "rootKeyId": "root_2026"
}
