{
  "$schema": "https://schemas.macro-deck.app/macrodeck-certificate-v1.schema.json",
  "schemaVersion": 1,
  "subject": {
    "kind": "creator",
    "id": "394954524831252582",
    "name": "DaNeo"
  },
  "algorithm": "ed25519",
  "certificateId": "cert_9e51be795c74b018fa47c7e80e5efe1c",
  "publicKey": "69oIgGueHqlWBVq23Kkzt/P1mEll8cABD2Y8UTnGWzo=",
  "keyUsage": [
    "package"
  ],
  "notBefore": "2026-10-13T16:00:52.9965755+00:00",
  "notAfter": "2028-10-12T16:00:52.9965755+00:00",
  "issuedAt": "2026-10-13T16:00:52.9965755+00:00",
  "rootKeyId": "root_2026"
}
